{
  "control_id": "inactive_room_future_stay",
  "version": 2,
  "source_control": "13",
  "name": "Inactive Room Assigned to Future Stay",
  "natural_language": "No future reservation may reference a room that is inactive or decommissioned.",
  "restricted_language": "every stay joining room by stay.room_number to room.number where reservation.status is not \"cancelled\" and stay.room_number exists must have room.number resolved and room.closed_from missing showing reservation.arrival_date",
  "entity": "stay",
  "population": {
    "description": "Non-cancelled reservations arriving from today onward. The room master is joined as a reference, one call for the whole property, rather than being queried per stay.",
    "provider_query": {
      "minihotel": {
        "endpoint": "GetReservationKey",
        "filters": {
          "ArrivalDate": {
            "From": "today",
            "To": "today+90d"
          }
        },
        "call_cost": "1 + R: one population call plus one room-master call, whatever the number of stays. v1's query started from getRooms and asked the engine to cut a rooms response into stays, which it cannot do - the join it described in prose is now declared as a reference."
      },
      "demopms": {
        "endpoint": "bookings",
        "filters": {
          "arrival": {
            "from": "today",
            "to": "today+90d"
          }
        },
        "then": [
          "rooms (all rooms, 1 call)"
        ],
        "call_cost": "O(1) - two bulk calls regardless of hotel size"
      }
    }
  },
  "references": [
    {
      "entity": "room",
      "kind": "lookup",
      "local_field": "stay.room_number",
      "remote_field": "room.number"
    }
  ],
  "scope": [
    {
      "field": "reservation.status",
      "operator": "not_equals",
      "value": "cancelled"
    },
    {
      "field": "stay.room_number",
      "operator": "exists"
    }
  ],
  "exceptions": [],
  "assertion": {
    "mode": "all",
    "predicates": [
      {
        "field": "room.number",
        "operator": "reference_exists",
        "note": "The assigned room still exists in the room master."
      },
      {
        "field": "room.closed_from",
        "operator": "not_exists",
        "note": "...and is not out of service."
      }
    ]
  },
  "required_evidence": [
    {
      "field": "stay.room_number",
      "source": "pms",
      "resolvable": true
    },
    {
      "field": "reservation.arrival_date",
      "source": "pms",
      "resolvable": true
    },
    {
      "field": "room.number",
      "source": "pms",
      "resolvable": true
    },
    {
      "field": "room.closed_from",
      "source": "pms",
      "resolvable": true
    },
    {
      "field": "reservation.status",
      "source": "pms",
      "resolvable": true,
      "note": "scope filter"
    }
  ],
  "execution": {
    "mode": "periodic",
    "minimum_interval": "6h",
    "rationale": "Type C, and the architecture doc's own worked example for this mode. A room can be decommissioned with no reservation event emitted, so events alone would miss it."
  },
  "freshness_requirement": {
    "maximum_age": "24h",
    "rationale": "Concerns future stays; there is time to react. The doc explicitly rates this class low-urgency."
  },
  "unknown_conditions": [
    {
      "when": "getRooms call fails",
      "reason": "cannot establish which rooms exist"
    },
    {
      "when": "a room is absent from getRooms",
      "reason": "absence is the signal, but it cannot be distinguished from a room that was never visible to this integration user. Note R6 was investigated and unmapped rooms ARE still returned, so this is unlikely - but it is not guaranteed for every tenant.",
      "risk": "R6"
    }
  ],
  "action": {
    "type": "notify",
    "severity": "medium",
    "audience": "front_office_manager"
  },
  "caveats": [
    "MiniHotel has no explicit active/inactive flag. 'Inactive' is inferred from absence from the room master or presence of a closed window.",
    "Room numbers are not always numeric - one sandbox room is named 'Nemanja'. Do not assume integer keys.",
    "The 'future' in this control's name is expressed by its population query (arrivals from today onward, resolved through the property's clock), not by a scope predicate. v1 carried both, and the scope copy compared a date against the literal string 'today' - a comparison that is always false, so every stay was excluded and the control reported a clean run over a property it had never looked at."
  ]
}
